{"artifacts":[{"bytes":3964880,"cache_control":"public, max-age=31536000, immutable","exposure":"public","integrity":"sha384-SOYsvEyqnHUbQLnPJ9ZhAp93wJPq2JcFrT9BNT0Z0IJTCvTxTdik7A29q9IWCnNk","path":"assets/application-bundle-d8c37518a38ef75511f59f91cdaf5385ebc0e0c688dccfdc311924248f4391e1.avm","role":"application-bundle","sha256":"d8c37518a38ef75511f59f91cdaf5385ebc0e0c688dccfdc311924248f4391e1"},{"bytes":9079,"cache_control":"public, max-age=31536000, immutable","exposure":"public","integrity":"sha384-z9OiZLOrhypv+XmsYNu7L/pRmyKYVxFQt8LAYQfN2WFzU7IyLAD5lKqU96IwVdh4","path":"assets/browser-host-04094a7d13bc911d907c6afe911752f38ceeabaafde3c8d842d84ae4da28ac5f.js","role":"browser-host","sha256":"04094a7d13bc911d907c6afe911752f38ceeabaafde3c8d842d84ae4da28ac5f"},{"bytes":2124,"cache_control":"public, max-age=31536000, immutable","exposure":"public","feature_id":"counter","integrity":"sha384-Ha//DdsR+gEd7OWC/j7ZQGmFXXeyAx0Oz3wWXtSZs1efyfoOBGlK5yjJ9n6ocQxu","path":"assets/feature-counter-fc3e56e3ac55ff42fa210aff2a8e040fe194262cc4ec9f3083aa486c4363585d.avm","role":"feature-bundle","sha256":"fc3e56e3ac55ff42fa210aff2a8e040fe194262cc4ec9f3083aa486c4363585d"},{"bytes":156421,"cache_control":"public, max-age=31536000, immutable","exposure":"public","integrity":"sha384-mtbJY1pcA0A65ScbTeiOQAbHQaqO24+dxt/BXA26TTr9UBrGJNco2JxOLmcrkezL","path":"assets/runtime-module-43cbf6ec34cd4745777b4ce70aa23844a6bb8af44c301c86a5dd02c0165bef64.mjs","role":"runtime-module","sha256":"43cbf6ec34cd4745777b4ce70aa23844a6bb8af44c301c86a5dd02c0165bef64"},{"bytes":986537,"cache_control":"public, max-age=31536000, immutable","exposure":"public","integrity":"sha384-vH973xEUuio0uSRN45NGzwvsia5reX6eOPeJpGFufOnQMMv9x8StVCP7CDw2mm0C","path":"assets/runtime-wasm-d20c491e75936dc8189910c8d0740093b7813d8dcc1cf966a87c011799ade9d8.wasm","role":"runtime-wasm","sha256":"d20c491e75936dc8189910c8d0740093b7813d8dcc1cf966a87c011799ade9d8"},{"bytes":141345,"cache_control":"no-store","exposure":"private-build-evidence","integrity":"sha384-OaSLgVnNRfKE9QLwkXB+NEQj6xXQzU8Q68R5ubwV8JXuKxJXXVSh//Ygpp5uM4/F","path":"evidence/bundle-plan-report-cfe3c28f057fa9f17a6cc89314a74ea4259757d6a0c1bbb9c1a6440a7abff35e.json","role":"bundle-plan-report","sha256":"cfe3c28f057fa9f17a6cc89314a74ea4259757d6a0c1bbb9c1a6440a7abff35e"},{"bytes":740,"cache_control":"no-store","exposure":"private-build-evidence","integrity":"sha384-guprPIQEeU1k2EQaUWHhQjdfkdRafuMHSbPVPFEbQ4b2SqHZuH1AFwVuP5RCJ1Zy","path":"evidence/client-safety-report-4f79b17eaa8b7bccdcd66d25962756a275b632d075ad6560213ff44ca36b36af.json","role":"client-safety-report","sha256":"4f79b17eaa8b7bccdcd66d25962756a275b632d075ad6560213ff44ca36b36af"},{"bytes":1675,"cache_control":"no-store","exposure":"private-build-evidence","integrity":"sha384-yNu/McDsCYaLVIY+Zw4rIWWyuTcWRXiX6jvVooCy0WwHJkXoMou16n9cU25RmLcY","path":"evidence/compatibility-report-ab3c6c67c9a74bef59588c6c7e4796e3c4df98a91c6f6369a0a2d1ac1648ab7e.json","role":"compatibility-report","sha256":"ab3c6c67c9a74bef59588c6c7e4796e3c4df98a91c6f6369a0a2d1ac1648ab7e"},{"bytes":150421,"cache_control":"no-store","exposure":"private-build-evidence","integrity":"sha384-AIZQ+LGk2MPg5BAWrsrUeMZy3VFptmuii5jPfXnR/NqntZypD9HMpoOV9YAx7HOn","path":"evidence/license-inventory-report-cb1cb3e79481fc833ab8cdaa2e26b9f7c1f8e671bd529daca83dee46d87d5962.json","role":"license-inventory-report","sha256":"cb1cb3e79481fc833ab8cdaa2e26b9f7c1f8e671bd529daca83dee46d87d5962"},{"bytes":1073,"cache_control":"no-store","exposure":"private-build-evidence","integrity":"sha384-XtAE3tSVi7bNj/QNPNtvKX9xqIlGJBD0kP5yGws7GvjtqdpONkrlqTE+usQR6GLM","path":"evidence/reachability-report-b362f03400ed05ef17027fbdb7904b9c78228bb1ef0041d3920b80f54f20e432.json","role":"reachability-report","sha256":"b362f03400ed05ef17027fbdb7904b9c78228bb1ef0041d3920b80f54f20e432"},{"bytes":212399,"cache_control":"no-store","exposure":"private-build-evidence","integrity":"sha384-49bcjOXiZFnF/6iedGwAkE1RlVEokYLIv08tyksAOkQhVPHDM2+dABmVPxZ/Y2wO","path":"evidence/runtime-closure-report-98cb99ead3012096b28ac696238ba4e90b838a11919a18fa91ee5a049a904bed.json","role":"runtime-closure-report","sha256":"98cb99ead3012096b28ac696238ba4e90b838a11919a18fa91ee5a049a904bed"},{"bytes":92870,"cache_control":"no-store","exposure":"private-build-evidence","integrity":"sha384-ioQPJHfUUFtviihmVW65KpbwQAuEcJG4fPTM2T/UprWziBrP0WITXh+QcUOPE7yO","path":"evidence/secret-audit-report-fa30ca9b20b66e92c1390b614416e3c3f516aa4bbb3157c2d65c1602dbc65836.json","role":"secret-audit-report","sha256":"fa30ca9b20b66e92c1390b614416e3c3f516aa4bbb3157c2d65c1602dbc65836"},{"bytes":528,"cache_control":"no-store","exposure":"public","integrity":"sha384-Oex3MXXhYZOBMytifWk8vlQod801GhLD0+49NkzeT2GoIuklWY7d+DyqSiDWbO5B","path":"index.html","role":"document","sha256":"9882ef408c829344dff32d20c404a4fceeab4f83f340270bf04ac529d8d9023f"}],"attestation_id":"blazex.bh06.entrypoint-accounting/1/counter","decision":"accept","entrypoint":{"id":"counter","module":"Elixir.BlazeX.BH06.VerticalSlice.Counter"},"evidence":{"bundle_plan":{"decision":"accept","policy_id":"blazex.bh06.feature-bundles/1","sha256":"cfe3c28f057fa9f17a6cc89314a74ea4259757d6a0c1bbb9c1a6440a7abff35e"},"client_safety":{"decision":"accept","policy_id":"blazex.bh06.client-safety/1","sha256":"4f79b17eaa8b7bccdcd66d25962756a275b632d075ad6560213ff44ca36b36af"},"compatibility":{"decision":"accept","sha256":"ab3c6c67c9a74bef59588c6c7e4796e3c4df98a91c6f6369a0a2d1ac1648ab7e"},"delivery_integrity":{"decision":"accept","policy_id":"blazex.bh06.delivery-integrity/1","sha256":"b4aaa7a5a499346bad1bc2157928d999e5d8efd4f6b6f8aedd1ef348c267995b"},"license_inventory":{"decision":"accept","policy_id":"blazex.bh06.license-provenance/1","sha256":"cb1cb3e79481fc833ab8cdaa2e26b9f7c1f8e671bd529daca83dee46d87d5962"},"payload":{"decision":"accept","policy_id":"blazex.bh06.payload/2","sha256":"3805e22b319d2e2b795f6465164da10423b473aeff345283f803ace54bedc70d"},"reachability":{"decision":"accept","sha256":"b362f03400ed05ef17027fbdb7904b9c78228bb1ef0041d3920b80f54f20e432"},"runtime_closure":{"decision":"accept","policy_id":"blazex.bh06.runtime-closure/1","sha256":"98cb99ead3012096b28ac696238ba4e90b838a11919a18fa91ee5a049a904bed"},"secret_audit":{"decision":"accept","policy_id":"blazex.bh06.secret-exclusion/1","sha256":"fa30ca9b20b66e92c1390b614416e3c3f516aa4bbb3157c2d65c1602dbc65836"}},"manifest":{"id":"blazex.bh06.browser-slice/1","sha256":"e34f342923d2b1ba86d758fec47a50c2df6cddaa2dbe1432f9041fd61b4b8c03","support_state":"unsupported-development-evidence"},"policy_id":"blazex.bh06.entrypoint-accounting/1","policy_sha256":"97ef00810d75dd436ef24dcd498bc1116e35aff7b526c7135ff30d1c8f454d7f","schema_version":"1.0.0","summary":{"artifacts":13,"failed_budgets":0,"license_records":11,"private_artifacts":7,"public_artifacts":6,"public_brotli_bytes":1606989,"public_decoded_bytes":5125775,"shipped_components":7}}
